<?xml version="1.0" encoding="UTF-8"?>
<obavestenje xmlns="http://www.ftn.uns.ac.rs/obavestenjecir"
 xmlns:xsi="http://www.w3.org/2001/XMLSchema-instance"
 xsi:schemaLocation="http://www.ftn.uns.ac.rs/obavestenjecir file:/C:/Users/TehnoCentar/Desktop/XML_i_web_servisi/dokumenti/xml%20i%20seme/obavestenjecir.xsd">
    <naziv_organa>naziv_organa0</naziv_organa>
    <sediste_organa>sediste_organa0</sediste_organa>
    <broj_predmeta>0</broj_predmeta>
    <datum>2006-05-04</datum>
    <ime>ime0</ime>
    <prezime>prezime0</prezime>
    <naziv>naziv0</naziv>
    <adresa_podnosioca_zahteva>adresa_podnosioca_zahteva0</adresa_podnosioca_zahteva>
    <naslov>O B A V E Š T E Nj E  o stavljanju na uvid dokumenta koji sadrži traženu informaciju i o izradi kopije</naslov>
    <uvid>
        <godina>2006</godina>
        <opis_trazene_informacije>opis_trazene_informacije0</opis_trazene_informacije>
        <ime_dana>Ponedeljak</ime_dana>
        <broj_sati>14</broj_sati>
        <pocetak_akcije>01:01:01.001</pocetak_akcije>
        <kraj_akcije>01:01:01.001</kraj_akcije>
        <naziv_zgrade>naziv_zgrade0</naziv_zgrade>
        <naziv_ulice>naziv_ulice0</naziv_ulice>
        <broj_ulice>0</broj_ulice>
        <broj_kancelarije>0</broj_kancelarije>
    </uvid>
    <paragraf broj="broj1">paragraf0</paragraf>
    <paragraf broj="broj3">paragraf1</paragraf>
    <iznos_troskova>
        <kolicina_novca>0</kolicina_novca>
    </iznos_troskova>
    <dostavljeno>Arhivi</dostavljeno>
</obavestenje>
